"AmazonID","Name","Price","Added"
"1119895189","If It′s Smart, It′s Vulnerable",15.89,"26 September 2022"
"1786185709","I am the Law: How Judge Dredd Predicted Our Future",13.19,"4 September 2022"
"1468093657","The Making of Prince of Persia: Journals 1985 - 1993",15.33,"30 August 2022"
"1501124021","Principles: Life and Work",15.58,"17 August 2022"
"0349411905","Deep Work: Rules for Focused Success in a Distracted World",9.98,"18 January 2019"
"1509866132","Hyperfocus: How to Work Less to Achieve More",6.99,"17 August 2022"
"0323997317","Hayabusa2 Asteroid Sample Return Mission: Technological Innovation and Advances",123.0,"16 August 2022"
"1788178564","Expert Secrets: The Underground Playbook for Converting Your Online Visitors into Lifelong Customers",11.75,"6 August 2022"
"1788178556","Dotcom Secrets: The Underground Playbook for Growing Your Company Online with Sales Funnels",14.99,"6 August 2022"
"3982195705","Zero to Sold: How to Start, Run, and Sell a Bootstrapped Business",20.59,"6 August 2022"
